{
  "run_id": "run-1777971225",
  "source_scope_obeyed": true,
  "queries": [
    "Plan query: \"online streaming video 3d point map reconstruction\" within CVPR 2026 official CVF/CVPR sources, ICLR 2026 official OpenReview sources, and ICML 2026 official conference/OpenReview/PMLR sources.",
    "Plan query: \"online streaming video\" \"3d point map\" reconstruction within the same official 2026 venue sources.",
    "Plan query: \"streaming video\" \"3D\" \"point map\" reconstruction within the same official 2026 venue sources.",
    "Plan query: \"online\" \"3D reconstruction\" \"streaming video\" within the same official 2026 venue sources.",
    "Plan query: \"point map\" \"video\" \"reconstruction\" within the same official 2026 venue sources.",
    "Searched location: https://cvpr.thecvf.com/virtual/2026/papers.html and rendered-discovered official data file https://cvpr.thecvf.com/static/virtual/data/cvpr-2026-orals-posters.json.",
    "Searched location: OpenReview API notes with invitation=ICLR.cc/2026/Conference/-/Submission and accepted venue labels ICLR 2026 Oral / ICLR 2026 Poster.",
    "Searched location: OpenReview group/API for ICML.cc/2026/Conference with accepted venue labels ICML 2026 spotlight / ICML 2026 regular; browser-rendered group page fallback also attempted.",
    "Searched location: PMLR proceedings landing pages for ICML 2026 availability; no in-scope ICML 2026 proceedings entries found as of 2026-05-05."
  ],
  "browser_render_attempts": [
    {
      "url": "https://cvpr.thecvf.com/virtual/2026/papers.html",
      "status": "success",
      "method": "playwright",
      "records_found": 375,
      "notes": "Static page stated JavaScript was required. Repo-local render-source helper loaded the page and revealed the official /static/virtual/data/cvpr-2026-orals-posters.json source list; that JSON was fetched under raw/sources/ for candidate enumeration."
    },
    {
      "url": "https://openreview.net/group?id=ICLR.cc/2026/Conference",
      "status": "not_needed",
      "method": "official_openreview_api",
      "records_found": 5352,
      "notes": "Static group page exposed accepted-paper tab queries. Official OpenReview API returned 224 oral and 5128 poster accepted records, so browser rendering was not needed for ICLR source enumeration."
    },
    {
      "url": "https://openreview.net/group?id=ICML.cc/2026/Conference",
      "status": "success",
      "method": "playwright",
      "records_found": 0,
      "notes": "Static group page showed public_submissions=false and accepted-paper tab queries, but OpenReview API returned no public accepted records. Repo-local render-source helper loaded the rendered page and found no source-like records."
    }
  ],
  "results": [
    {
      "source_id": "cvpr2026-37067",
      "title": "Point4Cast: Streaming Dynamic Scene Reconstruction and Forecasting",
      "authors_or_org": [
        "Xinhang Liu",
        "Pedro Miraldo",
        "Suhas Lohit",
        "Huaizu Jiang",
        "Naoko Sawada",
        "Yu-Wing Tai",
        "Chi-Keung Tang",
        "Moitreya Chatterjee"
      ],
      "date": "2026",
      "url_or_path": "https://cvpr.thecvf.com/virtual/2026/poster/37067",
      "source_type": "paper",
      "venue_or_publisher": "CVPR 2026 Accept (Highlight)",
      "abstract_or_snippet": "Understanding how the 3D world evolves over time is a fundamental task in computer vision, essential for embodied settings, autonomous driving, etc. It requires not only the reconstruction of the observed scene but also the anticipation of how the scene dynamics will unfold in the future. While the area of 3D reconstruction has progressed rapidly with the advent of recent feed-forward neural networks, forecasting future dynamics in 3D, given the 2D frames of a video remains unexplored. We present Point4Cast, a unified framework that processes streaming 2D frame sequences of a video to estimate the past, present, and future of the underlying dynamic scene, in 3D. At the core of our approach lies a persistently evolving latent \\emph{spacetime representation} that models the environment’s evolution across time. Upon receiving a new 2D frame, an update operation integrates the incoming evidence to refine the latent spacetime representation. When queried for any time instant, whether before, at, or beyond the timestamp of the last update.  A readout procedure predicts temporally conditioned point maps and camera parameters describing the scene geometry at the queried time. Unlike prior approaches for online dynamic scene reconstruction that estimate each frame’s point map solely at the timestamp of the last observed frame, Point4Cast achieves coherent reconstruction across any queried time. Empirical evaluations show that \\emph{Point4Cast} achieves state-of-the-art performance on streaming dynamic scene reconstruction and forecasting benchmarks, across multiple challenging datasets, while providing scene flow estimation and forecasting for free. The code will be released publicly.",
      "discovery_method": "browser_rendered_dom+official_json",
      "official_confirmation_url": "https://cvpr.thecvf.com/static/virtual/data/cvpr-2026-orals-posters.json",
      "scope_match_rationale": "Official CVPR 2026 virtual-site paper record from the rendered CVPR 2026 papers page data file."
    },
    {
      "source_id": "cvpr2026-39439",
      "title": "V-DPM: Video Reconstruction with Dynamic Point Maps",
      "authors_or_org": [
        "Edgar Sucar",
        "Eldar Insafutdinov",
        "Zihang Lai",
        "Andrea Vedaldi"
      ],
      "date": "2026",
      "url_or_path": "https://cvpr.thecvf.com/virtual/2026/poster/39439",
      "source_type": "paper",
      "venue_or_publisher": "CVPR 2026 Accept (Poster)",
      "abstract_or_snippet": "New, powerful 3D representations such as DUSt3R’s invariant point maps, which encode 3D shape and camera parameters, have significantly advanced feed-forward 3D reconstruction. While point maps assume static scenes, Dynamic Point Maps (DPMs) extend the concept to dynamic 3D content, also representing 3D scene motion.However, DPMs have so far been limited to image pairs and, like DUSt3R, require post-processing via optimization when more than two views are involved. We argue that DPMs are far more meaningful when applied to videos and introduce V-DPM to demonstrate this.First, we show how to set up DPMs for videos to optimize their representational power, ease of neural prediction, and reuse of pre-trained models. Second, we implement these ideas on top of VGGT, a recent state-of-the-art 3D reconstructor. Although VGGT was trained on static scenes, we show that a small amount of synthetic data suffices to adapt it into an effective V-DPM predictor.This yields state-of-the-art 3D and 4D reconstruction in dynamic settings. In particular, unlike recent dynamic extensions of VGGT such as P3, DPMs reconstruct not only dynamic depth but also the full 3D motion of every point in the scene.",
      "discovery_method": "browser_rendered_dom+official_json",
      "official_confirmation_url": "https://cvpr.thecvf.com/static/virtual/data/cvpr-2026-orals-posters.json",
      "scope_match_rationale": "Official CVPR 2026 virtual-site paper record from the rendered CVPR 2026 papers page data file."
    },
    {
      "source_id": "cvpr2026-37759",
      "title": "Ov3R: Open-Vocabulary Semantic 3D Reconstruction from RGB Videos",
      "authors_or_org": [
        "ZIREN GONG",
        "Xiaohan Li",
        "Fabio Tosi",
        "Jiawei Han",
        "Stefano Mattoccia",
        "Jianfei Cai",
        "Matteo Poggi"
      ],
      "date": "2026",
      "url_or_path": "https://cvpr.thecvf.com/virtual/2026/poster/37759",
      "source_type": "paper",
      "venue_or_publisher": "CVPR 2026 Accept (Highlight)",
      "abstract_or_snippet": "We present Ov3R, a novel framework for open-vocabulary semantic 3D reconstruction from RGB video streams, designed to advance Spatial AI. The system features two key components: CLIP3R, a CLIP-informed 3D reconstruction module that predicts dense point maps from overlapping clips alongside object-level semantics; and 2D–3D OVS, a 2D-3D open-vocabulary semantic module that lifts 2D features into 3D by learning fused descriptors integrating spatial, geometric, and semantic cues. Unlike prior methods, Ov3R incorporates CLIP semantics directly into the reconstruction process, enabling globally consistent geometry and fine-grained semantic alignment. Our framework achieves state-of-the-art performance in both dense 3D reconstruction and open-vocabulary 3D segmentation — marking a step forward toward real-time, semantics-aware Spatial AI.",
      "discovery_method": "browser_rendered_dom+official_json",
      "official_confirmation_url": "https://cvpr.thecvf.com/static/virtual/data/cvpr-2026-orals-posters.json",
      "scope_match_rationale": "Official CVPR 2026 virtual-site paper record from the rendered CVPR 2026 papers page data file."
    },
    {
      "source_id": "cvpr2026-38602",
      "title": "DynamicVGGT: Learning Dynamic Point Maps for 4D Scene Reconstruction in Autonomous Driving",
      "authors_or_org": [
        "Zhuolin He",
        "Jing Li",
        "Guanghao Li",
        "Xiaolei Chen",
        "Jiacheng Tang",
        "Siyang Zhang",
        "ZhouNanJin ZhouNanJin",
        "Feipeng Cai",
        "Bin Li",
        "Jian Pu",
        "Jia Cai",
        "Xiangyang Xue"
      ],
      "date": "2026",
      "url_or_path": "https://cvpr.thecvf.com/virtual/2026/poster/38602",
      "source_type": "paper",
      "venue_or_publisher": "CVPR 2026 Accept (Poster)",